{"base_commit":"5393338571f8ed5de5192613dcdd6131044932dc","candidate_id":"sha256:da0ece43bd050d3a3b1294db3179a1f88957e02df44d21ad32a2c62ffa951c2a","changed_paths":[".codex/agents/independent-reviewer.toml",".codex/review/reviewer.prompt.md","IMPLEMENTATION_STATUS.md","README.md","docs/adoption.md","docs/architecture.md","docs/decisions/0002-fresh-process-reviewer.md","docs/decisions/0007-rst-inspired-rapid-review.md","docs/decisions/ADR-0008-protect-one-admission-kernel-with-lkg-policy.md","docs/decisions/ADR-0010-isolate-untrusted-gates-and-govern-mutation.md","docs/decisions/ADR-0011-compile-model-context-deterministically.md","docs/decisions/ADR-0012-authenticate-and-reconstruct-reviewer-qualification.md","docs/decisions/ADR-0013-support-github-free-with-public-authority-and-private-broker.md","docs/decisions/ADR-0014-reconstruct-empirical-context-qualification.md","docs/implementation-plan.md","docs/requirements.md","docs/research.md","docs/specification.md","docs/test-strategy.md","docs/threat-model.md","docs/traceability.md","examples/context-projection.json","examples/context-qualification.json","examples/context-receipt.json","examples/context-source-bundle.json","examples/effective-policy.json","examples/evidence-manifest.json","examples/github/free/README.md","examples/github/free/authority-ref-reviewed.ruleset.json","examples/github/free/authority-ref.ruleset.json","examples/github/free/private-broker-disposition.yml","examples/github/free/private-broker-finalize.yml","examples/github/free/private-broker-qualify.yml","examples/github/free/target-main.ruleset.template.json","examples/github/governed-change.yml","examples/mutant-record.json","examples/provenance-statement.json","examples/rapid-review-session.json","examples/reviewer-execution.json","examples/reviewer-qualification-cases.json","examples/reviewer-qualification-corpus.json","examples/reviewer-qualification-label-decision.json","examples/reviewer-qualification.json","examples/reviewer-result.json","examples/rollback-evidence.json","examples/sandbox-capability.json","schemas/assurance-case.schema.json","schemas/authenticated-decision.schema.json","schemas/context-projection.schema.json","schemas/context-qualification.schema.json","schemas/context-receipt.schema.json","schemas/context-source-bundle.schema.json","schemas/effective-policy.schema.json","schemas/evidence-manifest.schema.json","schemas/gate-result.schema.json","schemas/provenance-statement.schema.json","schemas/rapid-review-session.schema.json","schemas/reviewer-execution.schema.json","schemas/reviewer-qualification-cases.schema.json","schemas/reviewer-qualification-corpus.schema.json","schemas/reviewer-qualification-label-decision.schema.json","schemas/reviewer-qualification.schema.json","schemas/reviewer-result.schema.json","schemas/rollback-evidence.schema.json","schemas/sandbox-capability.schema.json","scripts/rehearse_rollback.py","scripts/run_mutation_corpus.py","scripts/validate_blueprint.py","src/codex_governance/artifacts.py","src/codex_governance/assurance.py","src/codex_governance/attestation.py","src/codex_governance/authority.py","src/codex_governance/candidate.py","src/codex_governance/cli.py","src/codex_governance/context.py","src/codex_governance/evidence.py","src/codex_governance/gate.py","src/codex_governance/governance.py","src/codex_governance/lifecycle.py","src/codex_governance/locators.py","src/codex_governance/locking.py","src/codex_governance/mutation.py","src/codex_governance/mutation_runner.py","src/codex_governance/portability.py","src/codex_governance/qualification.py","src/codex_governance/rapid_review.py","src/codex_governance/reviewer.py","src/codex_governance/reviewer_namespace.py","src/codex_governance/reviewer_signal_guard.py","src/codex_governance/reviewer_supervisor.py","src/codex_governance/rollback.py","src/codex_governance/rst_operations.py","src/codex_governance/sandbox.py","src/codex_governance/schema.py","tests/acceptance/test_assurance_case.py","tests/acceptance/test_attestation.py","tests/acceptance/test_ci_admission.py","tests/acceptance/test_cli_orchestration.py","tests/acceptance/test_context_compiler.py","tests/acceptance/test_evidence_reconstruction.py","tests/acceptance/test_gate_sandbox.py","tests/acceptance/test_github_free_topology.py","tests/acceptance/test_governance_integrity.py","tests/acceptance/test_mutation_governance.py","tests/acceptance/test_pipeline_lock.py","tests/acceptance/test_rapid_review.py","tests/acceptance/test_reviewer_isolation.py","tests/acceptance/test_reviewer_qualification.py","tests/acceptance/test_rst_operations.py","tests/acceptance/test_schema_lifecycle.py","tests/acceptance/test_trusted_authority.py","tests/acceptance/test_workflow_profiles.py","tests/mutation/corpus.json","tests/unit/test_artifact_store.py","tests/unit/test_configuration.py","tests/unit/test_gate_runner.py","tests/unit/test_git_candidate.py","tests/unit/test_reviewer_adapter.py","tests/unit/test_schema_adapter.py"],"dirty":false,"effective_policy_sha256":"sha256:ba13ebf8b6e04788654e3b5b71c415e12353218b9fb9e69e30e832266e576830","head_commit":"8364322b1220830037527f0604e3f7228c0a6423","mode":"commit","repository_id":"repo:timaday/codex-governed-change","schema_version":"1.0.0","submodules":[],"tracked_diff_sha256":"sha256:1507d511a139d1625c7bcd8aadda6e69bf53a7ef78a681bd05d2a5a1678ea65d","untracked_entries":[]}